{
  "status_path": "/Volumes/T7 Touch/mini/rather-not-work-on/platform-planningops/planningops/artifacts/validation/federated-ci-20260326T122606Z-summary-tmp-reconcile-bundle-status.json",
  "bundle_path": "/Volumes/T7 Touch/mini/rather-not-work-on/platform-planningops/planningops/artifacts/validation/federated-ci-20260326T122606Z-summary-tmp-reconcile-bundle.json",
  "bundle_validation_report_path": "/Volumes/T7 Touch/mini/rather-not-work-on/platform-planningops/planningops/artifacts/validation/federated-ci-20260326T122606Z-summary-tmp-reconcile-bundle-validation.json",
  "schema_path": "/Volumes/T7 Touch/mini/rather-not-work-on/platform-planningops/planningops/schemas/federated-ci-summary-tmp-reconcile-bundle-status.schema.json",
  "validation_schema_path": "/Volumes/T7 Touch/mini/rather-not-work-on/platform-planningops/planningops/schemas/federated-ci-summary-tmp-reconcile-bundle-status-validation.schema.json",
  "output_path": "/Volumes/T7 Touch/mini/rather-not-work-on/platform-planningops/planningops/artifacts/validation/federated-ci-20260326T122606Z-summary-tmp-reconcile-bundle-status-validation.json",
  "generated_at_utc": "2026-03-26T12:30:32.075714+00:00",
  "verdict": "pass",
  "error_count": 0,
  "warning_count": 0,
  "errors": [],
  "warnings": [],
  "status_generated_at_utc": "2026-03-26T12:30:32.039491+00:00",
  "status_output_path": "/Volumes/T7 Touch/mini/rather-not-work-on/platform-planningops/planningops/artifacts/validation/federated-ci-20260326T122606Z-summary-tmp-reconcile-bundle-status.json",
  "status_validation_output_path": "/Volumes/T7 Touch/mini/rather-not-work-on/platform-planningops/planningops/artifacts/validation/federated-ci-20260326T122606Z-summary-tmp-reconcile-bundle-status-validation.json",
  "status_run_id": "federated-ci-20260326T122606Z",
  "status_reconcile_status": "healthy",
  "status_check_name": "loop-guardrails-outer-status-bundle-validation",
  "status_reconcile_count": 0,
  "status_reconcile_validation_verdict": "pass",
  "status_bundle_validation_verdict": "pass",
  "status_bundle_validation_state": "fresh",
  "status_ready": true,
  "status_next_step": "none"
}
